{
  "schema": "lonewolf.file_queue.supervised_dry_run_request.v1",
  "build_id": "20260613_codex_native_automation_gate_contracts_v1",
  "request_id": "supervised_dry_run_request_appdata_packet_creation_review_only",
  "chain_id": "chain_supervised_dry_run_contracts_v1",
  "task_id": "task_supervised_dry_run_contracts_v1",
  "task_json_path": "C:\\Users\\yu_ki\\AppData\\Local\\LoneWolfFang\\data\\task_supervised_dry_run_contracts_v1.json",
  "task_json_sha256": "AAAAAAAAAAAAAAAAAAAAAAAAAAAAAAAAAAAAAAAAAAAAAAAAAAAAAAAAAAAAAAAA",
  "validator_report_path": "C:\\Users\\yu_ki\\AppData\\Local\\LoneWolfFang\\data\\validator_supervised_dry_run_contracts_v1.json",
  "validator_report_sha256": "BBBBBBBBBBBBBBBBBBBBBBBBBBBBBBBBBBBBBBBBBBBBBBBBBBBBBBBBBBBBBBBB",
  "expected_validator_status": "VALID_DRY_RUN",
  "expected_validator_accepted": true,
  "operation_class": "APPDATA_PACKET_CREATION_REVIEW_ONLY",
  "output_root_policy": "APPDATA_ONLY",
  "output_root": "C:\\Users\\yu_ki\\AppData\\Local\\LoneWolfFang\\data",
  "owner_approval_phrase": "APPROVE_NEXT_WAVE_DOCS_SCHEMA_TESTS_FIXTURES_IMPLEMENTATION_SIX_WINDOW",
  "owner_gate_before_dry_run": true,
  "success_criteria": [
    "Write one AppData review packet as evidence only."
  ],
  "stop_conditions": [
    "Stop if any prohibited action appears."
  ],
  "allowed_files": [
    "docs/orchestration/file_queue_supervised_dry_run_request_result_contracts.md",
    "schema/orchestration/file_queue_supervised_dry_run_request.schema.json",
    "schema/orchestration/file_queue_supervised_dry_run_result.schema.json",
    "tests/file_queue_supervised_dry_run_contract.test.mjs"
  ],
  "allowed_operations": [
    "APPDATA_PACKET_CREATION_REVIEW_ONLY"
  ],
  "prohibited_actions": [
    "live_execution",
    "paper_trading",
    "order_cancel_fetch_balance",
    "deploy",
    "runtime_workflow",
    "task_execution",
    "executor_code",
    "shell_escape",
    "network_private_openai_api",
    "cloud_mutation",
    "billing_mutation",
    "daemon_watcher",
    "ui_automation",
    "process_kill",
    "security_bypass",
    "repo_mutation",
    "secrets_output"
  ],
  "expected_final_report_labels": [
    "artifact directory",
    "ZIP path",
    "ZIP SHA256",
    "changed files",
    "tests run",
    "final status"
  ],
  "no_executor_approval": true,
  "no_task_execution": true
}
